{
  "schema_version": 1,
  "protocol_id": "watkins-species-linear-probe-leakage-controlled-v1",
  "dataset": {
    "name": "beans_watkins_arrow_local_snapshot",
    "revision": "sha256-d6b6c32b9425-6f7eafa5f0a4",
    "record_id_scheme": "partition_row_index_v1",
    "artifacts": {
      "beans_watkins-train.arrow": "d6b6c32b9425c6233c89b39246970997b61c9d278b8d0d42cb507698d6152544",
      "beans_watkins-test.arrow": "6f7eafa5f0a4efae0d17b9814feed712eb9082b1ecc6baae22914c83f47bcf80"
    },
    "source_partitions": {
      "train": "beans_watkins-train.arrow",
      "test": "beans_watkins-test.arrow"
    }
  },
  "splits": {
    "train": [
      "train:0",
      "train:3",
      "train:4",
      "train:6",
      "train:7",
      "train:8",
      "train:11",
      "train:12",
      "train:13",
      "train:14",
      "train:15",
      "train:19",
      "train:20",
      "train:21",
      "train:22",
      "train:23",
      "train:24",
      "train:25",
      "train:26",
      "train:28",
      "train:29",
      "train:30",
      "train:31",
      "train:33",
      "train:34",
      "train:35",
      "train:36",
      "train:37",
      "train:38",
      "train:39",
      "train:40",
      "train:41",
      "train:42",
      "train:43",
      "train:44",
      "train:46",
      "train:47",
      "train:49",
      "train:51",
      "train:52",
      "train:54",
      "train:55",
      "train:56",
      "train:57",
      "train:58",
      "train:61",
      "train:62",
      "train:63",
      "train:64",
      "train:65",
      "train:66",
      "train:67",
      "train:69",
      "train:70",
      "train:71",
      "train:72",
      "train:75",
      "train:76",
      "train:77",
      "train:78",
      "train:79",
      "train:80",
      "train:81",
      "train:83",
      "train:85",
      "train:86",
      "train:87",
      "train:88",
      "train:90",
      "train:91",
      "train:92",
      "train:93",
      "train:94",
      "train:96",
      "train:97",
      "train:100",
      "train:101",
      "train:102",
      "train:104",
      "train:106",
      "train:108",
      "train:109",
      "train:110",
      "train:112",
      "train:113",
      "train:114",
      "train:115",
      "train:116",
      "train:117",
      "train:118",
      "train:121",
      "train:122",
      "train:123",
      "train:126",
      "train:127",
      "train:129",
      "train:130",
      "train:131",
      "train:133",
      "train:134",
      "train:135",
      "train:136",
      "train:137",
      "train:138",
      "train:139",
      "train:140",
      "train:141",
      "train:143",
      "train:144",
      "train:145",
      "train:146",
      "train:147",
      "train:148",
      "train:149",
      "train:150",
      "train:151",
      "train:152",
      "train:154",
      "train:155",
      "train:156",
      "train:157",
      "train:160",
      "train:161",
      "train:162",
      "train:163",
      "train:164",
      "train:165",
      "train:166",
      "train:168",
      "train:169",
      "train:170",
      "train:171",
      "train:172",
      "train:174",
      "train:175",
      "train:176",
      "train:177",
      "train:180",
      "train:181",
      "train:182",
      "train:184",
      "train:186",
      "train:187",
      "train:188",
      "train:189",
      "train:190",
      "train:192",
      "train:194",
      "train:195",
      "train:197",
      "train:198",
      "train:199",
      "train:200",
      "train:201",
      "train:202",
      "train:203",
      "train:204",
      "train:205",
      "train:206",
      "train:207",
      "train:208",
      "train:210",
      "train:212",
      "train:213",
      "train:214",
      "train:215",
      "train:217",
      "train:218",
      "train:219",
      "train:220",
      "train:221",
      "train:222",
      "train:223",
      "train:224",
      "train:225",
      "train:227",
      "train:228",
      "train:229",
      "train:230",
      "train:231",
      "train:235",
      "train:236",
      "train:237",
      "train:239",
      "train:240",
      "train:241",
      "train:242",
      "train:243",
      "train:246",
      "train:247",
      "train:249",
      "train:250",
      "train:251",
      "train:252",
      "train:253",
      "train:254",
      "train:255",
      "train:256",
      "train:257",
      "train:258",
      "train:259",
      "train:260",
      "train:262",
      "train:263",
      "train:265",
      "train:266",
      "train:267",
      "train:268",
      "train:269",
      "train:271",
      "train:272",
      "train:273",
      "train:274",
      "train:278",
      "train:281",
      "train:282",
      "train:283",
      "train:284",
      "train:285",
      "train:286",
      "train:287",
      "train:288",
      "train:290",
      "train:291",
      "train:294",
      "train:295",
      "train:296",
      "train:297",
      "train:299",
      "train:301",
      "train:302",
      "train:303",
      "train:304",
      "train:306",
      "train:307",
      "train:308",
      "train:310",
      "train:312",
      "train:313",
      "train:314",
      "train:317",
      "train:318",
      "train:321",
      "train:323",
      "train:325",
      "train:328",
      "train:329",
      "train:330",
      "train:331",
      "train:332",
      "train:333",
      "train:334",
      "train:335",
      "train:336",
      "train:337",
      "train:338",
      "train:339",
      "train:340",
      "train:341",
      "train:342",
      "train:343",
      "train:345",
      "train:348",
      "train:349",
      "train:352",
      "train:353",
      "train:354",
      "train:355",
      "train:356",
      "train:357",
      "train:358",
      "train:359",
      "train:360",
      "train:361",
      "train:362",
      "train:364",
      "train:365",
      "train:366",
      "train:367",
      "train:368",
      "train:369",
      "train:370",
      "train:371",
      "train:372",
      "train:374",
      "train:376",
      "train:377",
      "train:378",
      "train:379",
      "train:380",
      "train:381",
      "train:382",
      "train:383",
      "train:384",
      "train:385",
      "train:386",
      "train:388",
      "train:389",
      "train:390",
      "train:393",
      "train:395",
      "train:396",
      "train:397",
      "train:398",
      "train:399",
      "train:400",
      "train:401",
      "train:402",
      "train:403",
      "train:404",
      "train:405",
      "train:406",
      "train:407",
      "train:408",
      "train:409",
      "train:410",
      "train:411",
      "train:412",
      "train:413",
      "train:414",
      "train:417",
      "train:418",
      "train:419",
      "train:420",
      "train:421",
      "train:422",
      "train:424",
      "train:425",
      "train:426",
      "train:427",
      "train:428",
      "train:429",
      "train:430",
      "train:431",
      "train:432",
      "train:433",
      "train:434",
      "train:435",
      "train:436",
      "train:438",
      "train:439",
      "train:443",
      "train:444",
      "train:446",
      "train:447",
      "train:448",
      "train:449",
      "train:450",
      "train:451",
      "train:452",
      "train:453",
      "train:454",
      "train:455",
      "train:456",
      "train:459",
      "train:460",
      "train:461",
      "train:462",
      "train:463",
      "train:464",
      "train:466",
      "train:467",
      "train:468",
      "train:469",
      "train:470",
      "train:471",
      "train:472",
      "train:475",
      "train:476",
      "train:477",
      "train:478",
      "train:481",
      "train:482",
      "train:483",
      "train:484",
      "train:487",
      "train:488",
      "train:489",
      "train:490",
      "train:491",
      "train:492",
      "train:493",
      "train:494",
      "train:498",
      "train:499",
      "train:500",
      "train:501",
      "train:502",
      "train:503",
      "train:504",
      "train:505",
      "train:507",
      "train:508",
      "train:509",
      "train:510",
      "train:511",
      "train:512",
      "train:513",
      "train:514",
      "train:515",
      "train:517",
      "train:518",
      "train:520",
      "train:522",
      "train:523",
      "train:524",
      "train:525",
      "train:526",
      "train:529",
      "train:530",
      "train:531",
      "train:532",
      "train:533",
      "train:535",
      "train:538",
      "train:539",
      "train:540",
      "train:541",
      "train:542",
      "train:543",
      "train:544",
      "train:545",
      "train:546",
      "train:547",
      "train:548",
      "train:549",
      "train:550",
      "train:551",
      "train:552",
      "train:553",
      "train:554",
      "train:556",
      "train:557",
      "train:560",
      "train:561",
      "train:562",
      "train:563",
      "train:565",
      "train:566",
      "train:567",
      "train:568",
      "train:569",
      "train:570",
      "train:571",
      "train:572",
      "train:573",
      "train:574",
      "train:575",
      "train:576",
      "train:577",
      "train:579",
      "train:580",
      "train:581",
      "train:582",
      "train:583",
      "train:584",
      "train:587",
      "train:588",
      "train:589",
      "train:591",
      "train:592",
      "train:593",
      "train:594",
      "train:596",
      "train:597",
      "train:598",
      "train:600",
      "train:601",
      "train:603",
      "train:604",
      "train:605",
      "train:606",
      "train:607",
      "train:608",
      "train:609",
      "train:610",
      "train:611",
      "train:612",
      "train:613",
      "train:614",
      "train:615",
      "train:616",
      "train:618",
      "train:619",
      "train:620",
      "train:622",
      "train:623",
      "train:624",
      "train:625",
      "train:627",
      "train:628",
      "train:629",
      "train:630",
      "train:631",
      "train:632",
      "train:633",